{
  "$schema": "https://raw.githubusercontent.com/lperezperez/Set-ConsoleSettings/master/settings/colorscheme-schema.json",
  "ColorTable00": "#282828",
  "ColorTable01": "#3c3836",
  "ColorTable02": "#504945",
  "ColorTable03": "#665c54",
  "ColorTable04": "#bdae93",
  "ColorTable05": "#d5c4a1",
  "ColorTable06": "#d65d0e",
  "ColorTable07": "#ebdbb2",
  "ColorTable08": "#a89984",
  "ColorTable09": "#458588",
  "ColorTable10": "#98971a",
  "ColorTable11": "#689d6a",
  "ColorTable12": "#cc241d",
  "ColorTable13": "#b16286",
  "ColorTable14": "#d79921",
  "ColorTable15": "#fbf1c7"
}
