{
  "$schema": "https://raw.githubusercontent.com/lperezperez/Set-ConsoleSettings/master/settings/colorscheme-schema.json",
  "ColorTable00": "#fbf1c7",
  "ColorTable01": "#ebdbb2",
  "ColorTable02": "#d5c4a1",
  "ColorTable03": "#bdae93",
  "ColorTable04": "#665c54",
  "ColorTable05": "#504945",
  "ColorTable06": "#d65d0e",
  "ColorTable07": "#3c3836",
  "ColorTable08": "#7c6f64",
  "ColorTable09": "#458588",
  "ColorTable10": "#98971a",
  "ColorTable11": "#689d6a",
  "ColorTable12": "#cc241d",
  "ColorTable13": "#b16286",
  "ColorTable14": "#d79921",
  "ColorTable15": "#282828"
}
